Title,Text
Reaksi PKS Kala PDIP dan Anies Saling Puji,"Jakarta - PDIP dan mantan Gubernur DKI Jakarta Anies Baswedan saling melempar pujian dan menunjukkan ketertarikan terkait peluang dalam Pilkada Jakarta 2024. Lantas bagaimana reaksi PKS terkait hal itu?Awal mula saling lempar pujian ini dimulai dari Ketua DPP PDIP Puan Maharani. Saat itu, Puan berbicara terkait peluang Anies Baswedan untuk diusung dalam Pilkada Jakarta. Puan mengatakan Anies cukup menarik.Hal itu disampaikan Puan saat menjawab terkait nama Anies turut diperhitungkan atau tidak untuk diusung PDIP dalam Pilkada Jakarta.
""Menarik juga Pak Anies,"" kata Puan di kompleks parlemen Senayan, Jakarta Pusat, Selasa (4/6).Anies Baswedan ternyata menjawab pernyataan Puan Maharani. Dia akan melihat situasi terlebih dahulu sebelum mengambil kesimpulan.""PDIP juga menarik, jadi sambil kita lihat hari-hari ini, mudah-mudahan sampai pada kesimpulan,"" kata Anies, kepada wartawan, di kawasan Blok M, Jakarta Selatan, Jumat (7/6).Reaksi PKSLalu bagaimana rekasi PKS? Juru Bicara PKS Ahmad Mabruri menyebut wajar jika PDIP dan Anies saling memuji. Menurutnya, puji-pujian dapat memperlancar komunikasi.""Saya kira wajar ya saling memuji itu. Semua partai dan kandidat sekarang sedang intens berkomunikasi. Nah biar komunikasi lancar kan mesti dimulai dengan pujian,"" kata Mabruri saat dihubungi, Sabtu (8/6/2024).Mabruri menyebut PKS juga sampai saat ini masih menjalin komunikasi terkait Pilkada Jakarta. Dia menyebut calonnya nanti akan menunggu koalisi yang terbentuk.""PKS juga sedang berkomunikasi dengan partai partai untuk koalisi di pilkada Jakarta. Tentu kalau koalisi sudah deal tinggal tentukan siapa calon Jakarta 1 dan Jakarta 2-nya,"" ucapnya.Lantas bagaimana jika PKS dan PDIP bersama mengusung Anies? Mabruri menyebut PKS akan memprioritaskan partai-partai yang pernah menjadi teman koalisi.""Pada prinsipnya PKS terbuka dengan semua partai, namun saat ini PKS akan memprioritaskan terlebih dahulu pada partai-partai yang pernah menjadi teman koalisi, baik di Pilkada Jakarta ataupun di pilpres pada masa-masa sebelumnya,"" ujar dia.Namun, jika pada akhirnya harus bersama PDIP, dia menyebut tidak ada persoalan. Dia meminta semua pihak menunggu kejutan-kejutan yang akan datang.""Tidak masalah. Kan nanti yang memilih warga Jakarta. Partai-partai tugasnya mencalonkan kandidat terbaik. Sampai saat ini masih dalam proses. Tunggu saja nanti akan ada kejutan-kejutan,"" tutur dia.Simak Video 'Hasto Ditanya Anies Masuk Radar Jakarta: Mbak Puan Sudah Sampaikan':[Gambas:Video 20detik]
(whn/whn)"
PKB Ungkap Dukungan untuk Rival Khofifah di Pilgub Jatim Menguat,"Jakarta - Enam Partai telah mendukung pasangan petahana, Khofifah Indar Parawansa dan Emil Dardak, maju dalam Pemilihan Gubernur (Pilgub) Jawa Timur. PKB mengatakan suara untuk KH Marzuki Mustamar semakin kuat.""Desk Pilkada masih terus mematangkan, sejauh ini didukung basis kepada Kiai Merzuki semakin kuat,"" kata Ketua DPP PKB Daniel Johan, Minggu (9/6/2024).Meski begitu, Daniel menyebut partainya belum ambil keputusan. Namun, Daniel mengaku PKB akan segera mengumumkan soal Pilgub Jawa Timur (Jaktim).
Diketahui, dalam perolehan suara DPRD Jawa Timur (Jatim), PKB mendapat suara sekitar 27 persen, dan telah memenuhi syarat untuk mengusung sendiri. Meski begitu, Daniel menyebut PKB akan membuka komunikasi dengan partai lain.""PKB selalu terbuka dengan sahabat partai,"" ujarnya.""Tentu (berkoalisi) agar basis pemilih semakin kuat nanti,' katanya.Sebelumnya, Khofifah Indar Parawansa-Emil Dardak terus mendapat dukungan sejumlah partai politik untuk maju dalam Pilgub Jatim 2024. Tercatat, sudah ada enam partai yang sudah menyatakan dukungannya untuk Khofifah-Emil.Dirangkum detikcom, Minggu (9/6/2024) parpol yang pertama resmi mengusung Khofifah yakni Demokrat. Langkah serupa kemudian juga diikuti oleh Golkar, Perindo, PAN hingga PSI. Terbaru, Gerindra juga secara resmi menyatakan dukungan untuk pasangan Khofifah-Emil Dardak.Simak juga 'Khofifah Respons Tawaran Wakil dari PDIP: Saya dan Emil Sudah Sepaket':[Gambas:Video 20detik]
(aik/imk)"
PDIP Ingin Sekali Dukung Khofifah tapi Hal Ini Masih Jadi Pertimbangan,"Jakarta - Enam partai politik telah memberikan dukungan kepada petahana Khofifah Indar Parawansa, dan Emil Dardak untuk maju dalam Pilgub Jawa Timur (Jatim). PDIP menyebut telah menjalin komunikasi dengan Khofifah tapi juga berharap kadernya ikut berpartisipasi.""Tentu ada pertimbangan lain selain kami ingin sekali mendukung Ibu Khofifah, tapi sebagaimana diketahui, hasil Pileg, dan eksistensi kami di Jatim cukup besar. Kami merasa pantas ada kader partai yang meramaikan kontestasi pilkada,"" kata Juru Bicara PDIP Chico Hakim, Minggu (9/6/2024).Namun, Chico menyebut partinya belum menentukan sikap untuk Pilgub Jatim. PDIP akan terus menganalisa keadaan dan dinamika politik di Jawa Timur.
""Segala belum final, masih banyak pertimbangan yang dilakukan. Kami terus cermati bagaimana hasil-hasil survei, dan kami simulasi Cagub-Cawagub yang beda. Mana yang lebih memungkinkan untuk bisa menang di kontestasi ini,"" ujarnya.PDIP pun masih membuka kemungkinan untuk berkoalisi dengan partai-partai pendukung atau luar pendukung Khofifah. Dia pun menyebut masih memiliki waktu panjang sampai pendaftaran pada Agustus nanti.""Terkait kami juga kiranya usung sendiri calon dan koalisi dengan partai lain itu masih terbuka, dan termasuk kemungkinan mendukung Khofifah dan lain-lain. Semua dalam tahap penjajakan, pencermatan, kami masih merasa ada waktu untuk itu semua,"" ujarnya.Khofifah Indar Parawansa-Emil Dardak terus mendapat dukungan sejumlah partai politik untuk maju dalam Pilgub Jatim 2024. Tercatat, sudah ada enam partai yang sudah menyatakan dukungannya untuk Khofifah-Emil.Dirangkum detikcom, Minggu (9/6) parpol yang pertama resmi mengusung Khofifah yakni Demokrat. Langkah serupa kemudian juga diikuti oleh Golkar, Perindo, PAN hingga PSI. Terbaru, Gerindra juga secara resmi menyatakan dukungan untuk pasangan Khofifah-Emil Dardak.Simak juga 'Puja-puji Prabowo untuk Khofifah-Emil Dardak':[Gambas:Video 20detik]
(aik/imk)"
Analisis Pakar soal Kans Ridwan Kamil di Pilkada Jabar 2024,"Jakarta - Analis Komunikasi Politik Universitas Padjajaran Kunto Adi Wibowo menganalisis soal kans politisi Partai Golkar Ridwan Kamil dalam Pemilihan Gubernur (Pilgub) Jawa Barat (Jabar) 2024. Dia menyebut Ridwan Kamil mempunyai kans besar.""Kalau menurut saya ya Mas Ridwan Kamil punya kans besar karena dia baru satu periode,"" kata Kunto Adi Wibowo kepada wartawan, Minggu (9/6/2024).Kunto mengungkapkan elektabilitas mantan Gubernur Jabar tersebut di berbagai lembaga survei juga cukup tinggi. Karena itulah, kata Kunto, kans Ridwan Kamil untuk ke Jawa Barat juga besar.
""Kemarin juga hasil beberapa lembaga survei elektabilitas beliau cukup tinggi, sehingga kansnya untuk ke Jawa Barat juga besar,"" tuturnya.Diketahui, berdasarkan hasil survei yang dilakukan Saiful Mujani Research and Consulting (SMRC) bertajuk Peluang Calon-calon Gubernur dalam Pilkada Provinsi Jawa Barat pada 27 Mei - 2 Juni 2024, Ridwan Kamil berada di posisi tertinggi yakni 52,2 persen dalam simulasi pilihan semi terbuka dengan daftar 27 nama calon gubernur.Selanjutnya disusul Dedi Mulyadi dengan raihan 28,9 persen, Deddy Mizwar 3,8 persen, Dede Yusuf 1,9 persen, serta nama-nama lain di bawahnya. Ada 1,4 persen yang belum menjawab.Ridwan Kamil juga tertinggi di top of mind pada survei SMRC tersebut dengan elektabilitas 25,2 persen. Survei tersebut dilakukan terhadap 810 responden yang merupakan warga negara Indonesia (WNI) di Provinsi Jawa Barat, dengan metode penarikan acak bertingkat (multistage random sampling).Simak juga 'Prabowo soal Usung RK di Pilgub Jakarta: Tunggu Tanggal Mainnya':[Gambas:Video 20detik]
(whn/whn)"
